{
  "$schema": "../screw-spec-schema.json",
  "system": "PathFinder NXT",
  "manufacturer": "Highridge Medical",
  "type": "mis",
  "status": "active",
  "notes": "Polyaxial cannulated MIS system.",
  "source": "",
  "lastVerified": "",
  "screws": {
    "diameters": [],
    "lengthsByDiameter": {}
  },
  "rods": {
    "diameters": [5.5],
    "materials": ["titanium"],
    "profiles": ["round"]
  }
}
