{
  "$schema": "../screw-spec-schema.json",
  "system": "LineSider",
  "manufacturer": "Highridge Medical",
  "type": "thoracolumbar",
  "status": "active",
  "notes": "Universal shank size.",
  "source": "",
  "lastVerified": "",
  "screws": {
    "diameters": [],
    "lengthsByDiameter": {}
  },
  "rods": {
    "diameters": [],
    "materials": ["titanium", "cobalt_chrome"],
    "profiles": ["round"]
  }
}
