{
  "$schema": "../screw-spec-schema.json",
  "system": "CREO",
  "manufacturer": "Globus Medical",
  "type": "thoracolumbar",
  "status": "active",
  "notes": "Modular platform. 7.0/8.0/9.0mm are AMP dual-diameter screws (outer/inner). Standard diameters: 4.0-6.5, 7.5, 8.5, 9.5, 10.5. Lengths up to 120mm for pelvic fixation.",
  "source": "CREO Side-Loading Pedicle Screw System Technique Guide Rev D",
  "lastVerified": "2026-03-27",
  "screws": {
    "diameters": [4.0, 4.5, 5.0, 5.5, 6.0, 6.5, 7.0, 7.5, 8.0, 8.5, 9.0, 9.5, 10.5],
    "lengthsByDiameter": {
      "4.0": [20, 25, 30, 35, 40, 45],
      "4.5": [20, 25, 30, 35, 40, 45, 50],
      "5.0": [20, 25, 30, 35, 40, 45, 50, 55],
      "5.5": [25, 30, 35, 40, 45, 50, 55, 60],
      "6.0": [30, 35, 40, 45, 50, 55, 60],
      "6.5": [25, 30, 35, 40, 45, 50, 55, 60, 65, 70, 75, 80, 85, 90, 95, 100, 110, 120],
      "7.0": [70, 75, 80, 85, 90, 95, 100, 110, 120],
      "7.5": [25, 30, 35, 40, 45, 50, 55, 60, 65, 70, 75, 80, 85, 90, 95, 100, 110, 120],
      "8.0": [70, 75, 80, 85, 90, 95, 100, 110, 120],
      "8.5": [25, 30, 35, 40, 45, 50, 55, 60, 65, 70, 75, 80, 85, 90, 95, 100, 110, 120],
      "9.0": [70, 75, 80, 85, 90, 95, 100, 110, 120],
      "9.5": [30, 35, 40, 45, 50, 55, 60, 65, 70, 75, 80, 85, 90, 95, 100, 110, 120],
      "10.5": [30, 35, 40, 45, 50, 55, 60, 65, 70, 75, 80, 85, 90, 95, 100, 110, 120]
    }
  },
  "rods": {
    "diameters": [4.75, 5.5, 6.0, 6.35],
    "materials": ["titanium", "cobalt_chrome", "stainless_steel"],
    "profiles": ["round"]
  }
}
