{
  "$schema": "../screw-spec-schema.json",
  "system": "Xia 3",
  "manufacturer": "Stryker",
  "alsoSoldBy": ["VB Spine"],
  "type": "thoracolumbar",
  "status": "active",
  "notes": "Flagship thoracolumbar system. Vitallium = CoCr. CP-Ti rods also available.",
  "source": "Stryker Xia 3 Spinal System Surgical Technique Guide",
  "lastVerified": "2026-03-25",
  "screws": {
    "diameters": [4.0, 4.5, 5.0, 5.5, 6.0, 6.5, 7.0, 7.5, 8.5, 9.5, 10.5],
    "lengthsByDiameter": {
      "4.0":  [20, 22, 25, 30, 35, 40, 45],
      "4.5":  [20, 22, 25, 30, 35, 40, 45],
      "5.0":  [20, 25, 30, 35, 40, 45, 50],
      "5.5":  [25, 30, 35, 40, 45, 50, 55],
      "6.0":  [25, 30, 35, 40, 45, 50, 55, 60, 65, 70, 75, 80, 85, 90],
      "6.5":  [25, 30, 35, 40, 45, 50, 55, 60, 65, 70, 75, 80, 85, 90],
      "7.0":  [25, 30, 35, 40, 45, 50, 55, 60, 65, 70, 75, 80, 85, 90],
      "7.5":  [25, 30, 35, 40, 45, 50, 55, 60, 65, 70, 75, 80, 85, 90],
      "8.5":  [25, 30, 35, 40, 45, 50, 55, 60, 65, 70, 75, 80, 85, 90, 95, 100],
      "9.5":  [40, 45, 50, 55, 60, 65, 70, 75, 80, 85, 90, 95, 100],
      "10.5": [40, 45, 50, 55, 60, 65, 70, 75, 80, 85, 90, 95, 100]
    }
  },
  "rods": {
    "diameters": [5.5, 6.0],
    "materials": ["titanium", "cobalt_chrome", "cpt"],
    "profiles": ["round"]
  }
}
