{
  "$schema": "../screw-spec-schema.json",
  "system": "Vitality",
  "manufacturer": "Highridge Medical",
  "type": "thoracolumbar",
  "status": "active",
  "notes": "",
  "source": "",
  "lastVerified": "",
  "screws": {
    "diameters": [],
    "lengthsByDiameter": {}
  },
  "rods": {
    "diameters": [5.5, 6.0],
    "materials": ["titanium", "cobalt_chrome"],
    "profiles": ["round"]
  }
}
